{"schemaVersion":1,"population":{"sourceId":"S18","label":"mid-2025","referenceDate":"2025-06-30","boundaries":"ONS estimates on council boundaries of April 2024 (MYE note 10); the same year for all four nations"},"landArea":{"sourceId":"S18","definition":"Land area excluding inland water, km²: Standard Area Measurements (January 2025) for England, Wales and Scotland; NISRA's estimate for Northern Ireland (ONS MYE5, notes 18-19)"},"stores":{"sourceId":"S11","edition":"v46 (June 2026)","sizeBands":[{"id":"lt280","label":"Under 280 m²","value":"< 3,013 ft2 (280m2)","storeClass":"convenience"},{"id":"280to1400","label":"280 to 1,400 m²","value":"3,013 < 15,069 ft2 (280 < 1,400 m2)","storeClass":"supermarket"},{"id":"1400to2800","label":"1,400 to 2,800 m²","value":"15,069 < 30,138 ft2 (1,400 < 2,800 m2)","storeClass":"supermarket"},{"id":"ge2800","label":"2,800 m² and over","value":"30,138 ft2 > (2,800 m2)","storeClass":"supermarket"}],"storeClasses":[{"id":"supermarket","label":"Supermarket (280 m² and over)"},{"id":"convenience","label":"Convenience (under 280 m²)"}],"formats":[{"id":"standard","label":"High street and out of town","inDefaultView":true,"fascias":[]},{"id":"forecourt","label":"Petrol forecourt","inDefaultView":false,"fascias":["Asda PFS","Eurospar PFS","Little Waitrose Shell","Marks and Spencer BP","Morrisons Select","Spar PFS","Tesco Express Esso","The Co-operative Food PFS"]},{"id":"motorway","label":"Motorway services","inDefaultView":false,"fascias":["Marks and Spencer MSA","Waitrose MSA"]},{"id":"travel","label":"Station and airport","inDefaultView":false,"fascias":["Marks and Spencer Travel SF"]},{"id":"hospital","label":"Hospital","inDefaultView":false,"fascias":["Marks and Spencer Hospital"]}],"groups":[{"sizeBand":"lt280","format":"standard"},{"sizeBand":"lt280","format":"forecourt"},{"sizeBand":"lt280","format":"motorway"},{"sizeBand":"lt280","format":"travel"},{"sizeBand":"lt280","format":"hospital"},{"sizeBand":"280to1400","format":"standard"},{"sizeBand":"280to1400","format":"forecourt"},{"sizeBand":"280to1400","format":"motorway"},{"sizeBand":"280to1400","format":"travel"},{"sizeBand":"280to1400","format":"hospital"},{"sizeBand":"1400to2800","format":"standard"},{"sizeBand":"1400to2800","format":"forecourt"},{"sizeBand":"1400to2800","format":"motorway"},{"sizeBand":"1400to2800","format":"travel"},{"sizeBand":"1400to2800","format":"hospital"},{"sizeBand":"ge2800","format":"standard"},{"sizeBand":"ge2800","format":"forecourt"},{"sizeBand":"ge2800","format":"motorway"},{"sizeBand":"ge2800","format":"travel"},{"sizeBand":"ge2800","format":"hospital"}]},"councils":[{"code":"E06000001","name":"Hartlepool","nation":"England","population":99656,"landAreaKm2":93.7146,"note":null,"stores":[24,0,0,0,0,9,0,0,0,0,0,0,0,0,0,3,0,0,0,0]},{"code":"E06000002","name":"Middlesbrough","nation":"England","population":152795,"landAreaKm2":53.8815,"note":null,"stores":[29,2,0,0,1,11,0,0,0,0,1,0,0,0,0,2,0,0,0,0]},{"code":"E06000003","name":"Redcar and Cleveland","nation":"England","population":139541,"landAreaKm2":245.0785,"note":null,"stores":[30,1,0,0,0,13,0,0,0,0,5,0,0,0,0,3,0,0,0,0]},{"code":"E06000004","name":"Stockton-on-Tees","nation":"England","population":207158,"landAreaKm2":204.9433,"note":null,"stores":[32,1,0,0,0,17,0,0,0,0,3,0,0,0,0,6,0,0,0,0]},{"code":"E06000005","name":"Darlington","nation":"England","population":113402,"landAreaKm2":197.4895,"note":null,"stores":[14,1,0,0,0,10,0,0,0,0,1,0,0,0,0,3,0,0,0,0]},{"code":"E06000006","name":"Halton","nation":"England","population":131912,"landAreaKm2":79.0819,"note":null,"stores":[27,1,0,0,0,9,0,0,0,0,0,0,0,0,0,5,0,0,0,0]},{"code":"E06000007","name":"Warrington","nation":"England","population":215425,"landAreaKm2":180.6281,"note":null,"stores":[41,2,1,0,1,15,0,0,0,0,1,0,0,0,0,7,0,0,0,0]},{"code":"E06000008","name":"Blackburn with Darwen","nation":"England","population":163801,"landAreaKm2":137.0175,"note":null,"stores":[16,1,0,0,1,8,0,0,0,0,2,0,0,0,0,2,0,0,0,0]},{"code":"E06000009","name":"Blackpool","nation":"England","population":143492,"landAreaKm2":34.871,"note":null,"stores":[35,0,0,0,1,10,0,0,0,0,3,0,0,0,0,3,0,0,0,0]},{"code":"E06000010","name":"Kingston upon Hull, City of","nation":"England","population":273257,"landAreaKm2":71.5789,"note":null,"stores":[62,1,0,0,0,17,0,0,0,0,1,0,0,0,0,8,0,0,0,0]},{"code":"E06000011","name":"East Riding of Yorkshire","nation":"England","population":360334,"landAreaKm2":2403.5702,"note":null,"stores":[56,5,0,0,0,32,0,0,0,0,4,0,0,0,0,6,0,0,0,0]},{"code":"E06000012","name":"North East Lincolnshire","nation":"England","population":160101,"landAreaKm2":192.6232,"note":null,"stores":[36,1,0,0,0,10,0,0,0,0,2,0,0,0,0,5,0,0,0,0]},{"code":"E06000013","name":"North Lincolnshire","nation":"England","population":171421,"landAreaKm2":846.5403,"note":null,"stores":[39,1,0,0,0,14,0,0,0,0,2,0,0,0,0,4,0,0,0,0]},{"code":"E06000014","name":"York","nation":"England","population":209118,"landAreaKm2":271.9407,"note":null,"stores":[49,3,0,0,0,10,0,0,0,0,4,0,0,0,0,7,0,0,0,0]},{"code":"E06000015","name":"Derby","nation":"England","population":275344,"landAreaKm2":78.0201,"note":null,"stores":[40,5,0,0,1,21,0,0,0,0,4,0,0,0,0,7,0,0,0,0]},{"code":"E06000016","name":"Leicester","nation":"England","population":383116,"landAreaKm2":73.3399,"note":null,"stores":[43,3,0,0,0,19,0,0,0,0,2,0,0,0,0,5,0,0,0,0]},{"code":"E06000017","name":"Rutland","nation":"England","population":41629,"landAreaKm2":381.817,"note":null,"stores":[4,3,0,0,0,3,0,0,0,0,2,0,0,0,0,0,0,0,0,0]},{"code":"E06000018","name":"Nottingham","nation":"England","population":325765,"landAreaKm2":74.6251,"note":null,"stores":[57,3,0,0,0,21,0,0,0,0,5,0,0,0,0,6,0,0,0,0]},{"code":"E06000019","name":"Herefordshire, County of","nation":"England","population":192539,"landAreaKm2":2179.6887,"note":null,"stores":[24,4,0,0,0,15,0,0,0,0,3,0,0,0,0,6,0,0,0,0]},{"code":"E06000020","name":"Telford and Wrekin","nation":"England","population":199378,"landAreaKm2":290.2731,"note":null,"stores":[23,2,0,0,0,13,0,0,0,0,3,0,0,0,0,6,0,0,0,0]},{"code":"E06000021","name":"Stoke-on-Trent","nation":"England","population":272282,"landAreaKm2":93.4361,"note":null,"stores":[41,3,0,0,0,21,0,0,0,0,2,0,0,0,0,6,0,0,0,0]},{"code":"E06000022","name":"Bath and North East Somerset","nation":"England","population":200898,"landAreaKm2":345.9101,"note":null,"stores":[50,1,0,0,0,6,0,0,0,0,6,0,0,0,0,4,0,0,0,0]},{"code":"E06000023","name":"Bristol, City of","nation":"England","population":495260,"landAreaKm2":109.6615,"note":null,"stores":[78,6,0,0,2,33,0,0,0,0,5,0,0,0,0,9,0,0,0,0]},{"code":"E06000024","name":"North Somerset","nation":"England","population":227160,"landAreaKm2":373.7875,"note":null,"stores":[35,1,1,0,0,13,0,0,0,0,9,0,0,0,0,4,0,0,0,0]},{"code":"E06000025","name":"South Gloucestershire","nation":"England","population":308787,"landAreaKm2":497.0174,"note":null,"stores":[51,5,0,0,0,19,0,0,0,0,8,0,0,0,0,9,0,0,0,0]},{"code":"E06000026","name":"Plymouth","nation":"England","population":271361,"landAreaKm2":79.8455,"note":null,"stores":[45,2,0,0,1,23,0,0,0,0,2,0,0,0,0,7,0,0,0,0]},{"code":"E06000027","name":"Torbay","nation":"England","population":139486,"landAreaKm2":62.885,"note":null,"stores":[36,1,0,0,0,7,0,0,0,0,4,0,0,0,0,4,0,0,0,0]},{"code":"E06000030","name":"Swindon","nation":"England","population":245286,"landAreaKm2":230.0634,"note":null,"stores":[33,2,0,0,0,18,0,0,0,0,4,0,0,0,0,6,0,0,0,0]},{"code":"E06000031","name":"Peterborough","nation":"England","population":224757,"landAreaKm2":343.4015,"note":null,"stores":[24,4,0,0,0,14,0,0,0,0,5,0,0,0,0,6,0,0,0,0]},{"code":"E06000032","name":"Luton","nation":"England","population":236380,"landAreaKm2":43.3526,"note":null,"stores":[23,2,0,0,0,14,0,0,0,0,1,0,0,0,0,3,0,0,0,0]},{"code":"E06000033","name":"Southend-on-Sea","nation":"England","population":185214,"landAreaKm2":41.6737,"note":null,"stores":[32,5,0,0,0,13,0,0,0,0,0,0,0,0,0,5,0,0,0,0]},{"code":"E06000034","name":"Thurrock","nation":"England","population":181664,"landAreaKm2":163.8359,"note":null,"stores":[21,4,1,0,0,7,0,0,0,0,0,0,0,0,0,5,0,0,0,0]},{"code":"E06000035","name":"Medway","nation":"England","population":292697,"landAreaKm2":193.7212,"note":null,"stores":[41,4,1,0,0,13,0,0,0,0,3,0,0,0,0,6,0,0,0,0]},{"code":"E06000036","name":"Bracknell Forest","nation":"England","population":132145,"landAreaKm2":109.3746,"note":null,"stores":[17,4,0,0,0,3,0,0,0,0,3,0,0,0,0,6,0,0,0,0]},{"code":"E06000037","name":"West Berkshire","nation":"England","population":165523,"landAreaKm2":704.1771,"note":null,"stores":[26,1,5,0,0,9,0,0,0,0,5,0,0,0,0,3,0,0,0,0]},{"code":"E06000038","name":"Reading","nation":"England","population":183762,"landAreaKm2":40.3935,"note":null,"stores":[21,6,0,0,1,12,0,0,0,0,4,0,0,0,0,4,0,0,0,0]},{"code":"E06000039","name":"Slough","nation":"England","population":167450,"landAreaKm2":32.5421,"note":null,"stores":[13,2,0,0,0,7,0,0,0,0,0,0,0,0,0,3,0,0,0,0]},{"code":"E06000040","name":"Windsor and Maidenhead","nation":"England","population":159776,"landAreaKm2":196.4875,"note":null,"stores":[30,2,0,0,0,5,0,0,0,0,6,0,0,0,0,1,0,0,0,0]},{"code":"E06000041","name":"Wokingham","nation":"England","population":189024,"landAreaKm2":178.9739,"note":null,"stores":[21,6,0,0,0,8,0,0,0,0,6,0,0,0,0,3,0,0,0,0]},{"code":"E06000042","name":"Milton Keynes","nation":"England","population":308866,"landAreaKm2":308.645,"note":null,"stores":[49,5,1,1,0,18,0,0,0,0,3,0,0,0,0,10,0,0,0,0]},{"code":"E06000043","name":"Brighton and Hove","nation":"England","population":284170,"landAreaKm2":82.8217,"note":null,"stores":[54,4,0,1,1,9,0,0,0,0,8,0,0,0,0,4,0,0,0,0]},{"code":"E06000044","name":"Portsmouth","nation":"England","population":211475,"landAreaKm2":40.3867,"note":null,"stores":[40,2,0,0,1,14,0,0,0,0,3,0,0,0,0,4,0,0,0,0]},{"code":"E06000045","name":"Southampton","nation":"England","population":259230,"landAreaKm2":49.8807,"note":null,"stores":[41,3,0,0,1,13,0,0,0,0,4,0,0,0,0,5,0,0,0,0]},{"code":"E06000046","name":"Isle of W